<?xml version="1.0" encoding="UTF-8" ?>
<xs:schema xmlns:xs="http://www.w3.org/2001/XMLSchema" elementFormDefault="qualified">

    <xs:element name="learning-module">
        <xs:complexType>
            <xs:sequence>
                <xs:element ref="metadata"/>
                <xs:element ref="entries"/>
            </xs:sequence>
        </xs:complexType>
    </xs:element>

    <xs:element name="metadata">
        <xs:complexType>
            <xs:sequence>
                <xs:element name="name" type="xs:string" />
                <xs:element name="author" type="xs:string" />
                <xs:element name="description" type="xs:string" />
                <xs:element name="updated" type="xs:string" />
                <xs:element name="file-version" type="xs:string" />
                <xs:element name="format-version" type="xs:string" />
            </xs:sequence>
        </xs:complexType>
    </xs:element>

    <xs:element name="entries">
        <xs:complexType>
            <xs:sequence>
                <xs:element ref="entry" maxOccurs="unbounded"/>
            </xs:sequence>
        </xs:complexType>
    </xs:element>

    <xs:element name="entry">
        <xs:complexType>
            <xs:sequence>
                <xs:element name="question" type="xs:string" />
                <xs:element name="category-declaration" minOccurs="0" maxOccurs="unbounded">
                    <xs:complexType>
                        <xs:simpleContent>
                            <xs:extension base="xs:string">
                                <xs:attribute name="id" type="xs:string" />
                            </xs:extension>
                        </xs:simpleContent>
                    </xs:complexType>
                </xs:element>
                <xs:element name="answer" maxOccurs="unbounded">
                    <xs:complexType>
                        <xs:simpleContent>
                            <xs:extension base="xs:string">
                                <xs:attribute name="correct" type="xs:boolean" />
                                <xs:attribute name="id" type="xs:string" />
                                <xs:attribute name="category" type="xs:string" use="optional"/>
                            </xs:extension>
                        </xs:simpleContent>
                    </xs:complexType>
                </xs:element>
            </xs:sequence>
            <xs:attribute name="type" type="xs:string" />
            <xs:attribute name="id" type="xs:string" />
            <xs:attribute name="sampleable" type="xs:boolean" />
        </xs:complexType>
    </xs:element>

</xs:schema>
